{
  "evaluation_version": "1.2.0",
  "required_profiles": [
    "NARRATIVE",
    "TABLES"
  ],
  "coverage_review": {
    "status": "PENDING",
    "reviewer_id": "",
    "rationale": "",
    "scope_digest": "8120b368acfb6916d68d3cceb1f482a1c222e6db26acc68f23587f25f39b55a1"
  },
  "cases": [
    {
      "case_id": "LF-DOCX-001",
      "local_path": "REPLACE_PRIVATELY.docx",
      "format": "DOCX",
      "document_role": "TARGET",
      "business_role": "TARGET_TEMPLATE",
      "privacy_classification": "CONFIDENTIAL",
      "expected_feature_profile": [
        "NARRATIVE",
        "TABLES"
      ],
      "review_status": "PENDING"
    }
  ]
}
